Property_ID,Property Type,Bedrooms,Bathrooms,Area,Price,Description,Location,District,City
L533951000,فیلا,8.0,6.0,309.0,2999986.0,"فيلا للبيع في المونسية, شرق الرياض",المونسية، شرق الرياض، الرياض,حي المونسية,الرياض
G227283547,شقة,3.0,3.0,128.0,550000.0,شقة للبيع في الزهرة، غرب الرياض,الزهرة، غرب الرياض، الرياض,حي الزهرة,الرياض
Q482655125,ارض سكنية,0.0,0.0,360.0,1332000.0,أرض للبيع في  الرمال، شرق الرياض,الرمال، شرق الرياض، الرياض,حي الرمال,الرياض
Z982251838,شقة,4.0,5.0,186.0,1060000.0,شقة للبيع في العارض، شمال الرياض,العارض، شمال الرياض، الرياض,حي العارض,الرياض
X374599990,فیلا,5.0,6.0,600.0,5500000.0,فيلا درج داخلي للبيع في قرطبة، شرق الرياض,قرطبة، شرق الرياض، الرياض,حي قرطبة,الرياض
J976517749,شقة,2.0,3.0,2594.0,1750000.0,"شقة للبيع في شارع رايه, حي قرطبة, مدينة الرياض, منطقة الرياض",قرطبة، شرق الرياض، الرياض,حي قرطبة,الرياض
W957418621,شقة,3.0,3.0,167.0,1250000.0,شقة للبيع في المونسية، شرق الرياض,المونسية، شرق الرياض، الرياض,حي المونسية,الرياض
V022019688,دور,4.0,3.0,506.0,1650000.0,دور للبيع في القادسية، شرق الرياض,القادسية، شرق الرياض، الرياض,حي القادسية,الرياض
X145492737,فیلا,11.0,7.0,315.0,3500000.0,"فيلا للبيع في حي العارض, مدينة الرياض, منطقة الرياض",العارض، شمال الرياض، الرياض,حي العارض,الرياض
P861763332,فیلا,5.0,4.0,600.0,5000000.0,"فيلا للبيع في العارض, شمال الرياض",العارض، شمال الرياض، الرياض,حي العارض,الرياض
W014262226,شقة,5.0,4.0,151.0,570000.0,"شقة للبيع في حي نمار, مدينة الرياض, منطقة الرياض",نمار، غرب الرياض، الرياض,حي نمار,الرياض
U520123149,شقة,4.0,3.0,139.0,850000.0,"شقة للبيع في العارض, شمال الرياض",العارض، شمال الرياض، الرياض,حي العارض,الرياض
P963642425,فیلا,8.0,7.0,312.0,3200000.0,"فيلا للبيع في شارع أحمد بن زياد, حي العارض, مدينة الرياض, منطقة الرياض",العارض، شمال الرياض، الرياض,حي العارض,الرياض
X611678674,شقة,3.0,3.0,131.0,590000.0,شقة للبيع في ظهرة لبن، غرب الرياض,ظهرة لبن، غرب الرياض، الرياض,حي ظهرة لبن,الرياض
V745371960,شقة,4.0,3.0,88.0,797000.0,شقة للبيع في القادسية، شرق الرياض,القادسية، شرق الرياض، الرياض,حي القادسية,الرياض
S404506846,فیلا,5.0,6.0,252.0,3400000.0,فيلا درج داخلي للبيع في النرجس، شمال الرياض,النرجس، شمال الرياض، الرياض,حي النرجس,الرياض
Y263814753,فیلا,5.0,6.0,288.0,3750000.0,فيلا زاوية للبيع في النرجس، شمال الرياض,النرجس، شمال الرياض، الرياض,حي النرجس,الرياض
B528516548,فیلا,4.0,6.0,360.0,4500000.0,فيلا للبيع في النرجس، شمال الرياض,النرجس، شمال الرياض، الرياض,حي النرجس,الرياض
Y458240444,فیلا,4.0,7.0,400.0,2150000.0,فيلا مودرن بحي المهدية,المهدية، غرب الرياض، الرياض,حي المهدية,الرياض
C451135740,شقة,3.0,3.0,135.0,530000.0,٣ غرف نوم شقة للبيع الحزم,الحزم، غرب الرياض، الرياض,حي الحزم,الرياض
F310688824,فیلا,6.0,5.0,375.0,3200000.0,فيلا للبيع في العارض، شمال الرياض,العارض، شمال الرياض، الرياض,حي العارض,الرياض
P945037582,دور,6.0,4.0,199.0,900000.0,دور أول علوي للبيع في القادسية، شرق الرياض,القادسية، شرق الرياض، الرياض,حي القادسية,الرياض
S518539442,دور,6.0,4.0,300.0,1200000.0,دور للبيع في حي القادسيه، شرق الرياض,القادسية، شرق الرياض، الرياض,حي القادسية,الرياض
C669405434,دور,4.0,4.0,303.0,1150000.0,دور أرضي للبيع في القادسية، شرق الرياض,القادسية، شرق الرياض، الرياض,حي القادسية,الرياض
B100764413,شقة,4.0,4.0,88.0,797000.0,للبيع شقة في القادسية، شرق الرياض,القادسية، شرق الرياض، الرياض,حي القادسية,الرياض
K111440140,دور,6.0,4.0,222.0,1200000.0,دور أرضي للبيع في القادسية، شرق الرياض,القادسية، شرق الرياض، الرياض,حي القادسية,الرياض
F636533309,دور,4.0,4.0,199.0,900000.0,دور علوي للبيع في القادسية، شرق الرياض,القادسية، شرق الرياض، الرياض,حي القادسية,الرياض
Z763213353,دور,4.0,3.0,750.0,900000.0,دور للبيع في طويق، غرب الرياض,طويق، غرب الرياض، الرياض,حي طويق,الرياض
Y100401949,دور,4.0,5.0,185.0,1100000.0,دور للبيع في الجنادرية، شرق الرياض,الجنادرية، شرق الرياض، الرياض,حي الجنادرية,الرياض
K057806927,دور,3.0,4.0,202.0,660000.0,منزل جميل ومريح جدا جدا,طيبة، جنوب الرياض، الرياض,حي طيبة,الرياض
C261050322,دور,6.0,6.0,168.0,1100000.0,"دور للبيع في القادسية, شرق الرياض",القادسية، شرق الرياض، الرياض,حي القادسية,الرياض
J299930852,دور,3.0,4.0,185.0,750000.0,دور فاخر للبيع في الجنادرية، شرق الرياض,الجنادرية، شرق الرياض، الرياض,حي الجنادرية,الرياض
A941488347,فیلا,6.0,6.0,276.0,1700000.0,فيلا مودرن للبيع في حي البيان، شرق الرياض,حي البيان، شرق الرياض، الرياض,حي حي البيان,الرياض
D924138740,شقة,3.0,4.0,140.0,790000.0,شقة فاخرة للبيع في القادسية، شرق الرياض,القادسية، شرق الرياض، الرياض,حي القادسية,الرياض
Y746464108,فیلا,4.0,5.0,276.0,1700000.0,للبيع فلل دوبلكس في حي البيان، شرق الرياض,حي البيان، شرق الرياض، الرياض,حي حي البيان,الرياض
Z426924247,دور,5.0,4.0,305.0,1400000.0,دو أرضي للبيع في القادسية، شرق الرياض,القادسية، شرق الرياض، الرياض,حي القادسية,الرياض
E525589363,دور,4.0,3.0,196.0,850000.0,دور للبيع في حي البيان، شرق الرياض,حي البيان، شرق الرياض، الرياض,حي حي البيان,الرياض
P417879759,فیلا,5.0,6.0,276.0,1700000.0,فيلا فاخرة للبيع في حي البيان، شرق الرياض,حي البيان، شرق الرياض، الرياض,حي حي البيان,الرياض
L426905174,شقة,4.0,3.0,159.0,905000.0,شقة للبيع في القادسية، شرق الرياض,القادسية، شرق الرياض، الرياض,حي القادسية,الرياض
R991795373,شقة,4.0,3.0,140.0,790000.0,شقة للبيع في القادسية، شرق الرياض,القادسية، شرق الرياض، الرياض,حي القادسية,الرياض
Y633650846,فیلا,4.0,5.0,400.0,4000000.0,فيلا للبيع بحي المهديه ، الرياض,المهدية، غرب الرياض، الرياض,حي المهدية,الرياض
M966830306,دور,4.0,3.0,343.0,645000.0,دور للبيع في الخالدية، وسط الرياض,الخالدية، وسط الرياض، الرياض,حي الخالدية,الرياض
A170259227,شقة,5.0,4.0,188.0,480000.0,شقة للبيع في الحزم، غرب الرياض,الحزم، غرب الرياض، الرياض,حي الحزم,الرياض
M906292945,شقة,3.0,4.0,120.0,950000.0,شقة للبيع في العارض، شمال الرياض,العارض، شمال الرياض، الرياض,حي العارض,الرياض
A431295026,فیلا,6.0,4.0,260.0,2400000.0,"فيلا للبيع في المونسية, شرق الرياض",المونسية، شرق الرياض، الرياض,حي المونسية,الرياض
J060455906,شقة,4.0,3.0,147.0,530000.0,"شقة للبيع في الحزم, غرب الرياض",الحزم، غرب الرياض، الرياض,حي الحزم,الرياض
M394763935,فیلا,5.0,5.0,630.0,1800000.0,"فيلا للبيع في العزيزية, جنوب الرياض",العزيزية، جنوب الرياض، الرياض,حي العزيزية,الرياض
A373845258,شقة,5.0,3.0,190.0,730000.0,شقة للبيع في  العوالي، غرب الرياض,العوالي، غرب الرياض، الرياض,حي العوالي,الرياض
Z227286265,شقة,5.0,3.0,194.0,730000.0,شقة للبيع في  العوالي، غرب الرياض,العوالي، غرب الرياض، الرياض,حي العوالي,الرياض
F024593609,شقة,5.0,3.0,190.0,730000.0,شقة - الرياض - العوالي,العوالي، غرب الرياض، الرياض,حي العوالي,الرياض
T952494531,دور,3.0,3.0,506.0,1200000.0,دور للبيع في القادسية، شرق الرياض,القادسية، شرق الرياض، الرياض,حي القادسية,الرياض
U529009311,شقة,3.0,3.0,84.0,830000.0,شقة للبيع في العارض، شمال الرياض,العارض، شمال الرياض، الرياض,حي العارض,الرياض
D184845127,فیلا,4.0,5.0,324.0,2650000.0,فيلا للبيع في المونسية، شرق الرياض,المونسية، شرق الرياض، الرياض,حي المونسية,الرياض
K318349462,فیلا,5.0,5.0,300.0,2500000.0,"فيلا للبيع في المونسية, شرق الرياض",المونسية، شرق الرياض، الرياض,حي المونسية,الرياض
O938392991,دور,3.0,3.0,186.0,1500000.0,"دور للبيع في النرجس, شمال الرياض",النرجس، شمال الرياض، الرياض,حي النرجس,الرياض
P251393649,دور,3.0,4.0,177.0,1300000.0,دور للبيع في اليرموك، شرق الرياض,اليرموك، شرق الرياض، الرياض,حي اليرموك,الرياض
M209238695,فیلا,5.0,6.0,525.0,2625000.0,"فيلا للبيع في الخليج, شرق الرياض",الخليج، شرق الرياض، الرياض,حي الخليج,الرياض
Q455701869,دور,3.0,5.0,186.0,1400000.0,"دور للبيع في النرجس, شمال الرياض",النرجس، شمال الرياض، الرياض,حي النرجس,الرياض
R116141261,عمارة سكنية,0.0,0.0,1404.0,850000.0,"عمارة للبيع في الخليج, شرق الرياض",الخليج، شرق الرياض، الرياض,حي الخليج,الرياض
T032696786,فیلا,6.0,6.0,324.0,2800000.0,"فيلا للبيع في العارض, شمال الرياض",العارض، شمال الرياض، الرياض,حي العارض,الرياض
Z709754554,فیلا,6.0,6.0,400.0,4000000.0,فيلا للبيع في حي المهدية ، الرياض,المهدية، غرب الرياض، الرياض,حي المهدية,الرياض
A149723898,شقة,3.0,3.0,180.0,685000.0,شقة للبيع في العوالي، غرب الرياض,العوالي، غرب الرياض، الرياض,حي العوالي,الرياض
K746967363,فیلا,5.0,5.0,735.0,4000000.0,فيلا للبيع في المونسية، شرق الرياض,المونسية، شرق الرياض، الرياض,حي المونسية,الرياض
V776890403,فیلا,7.0,7.0,360.0,1500000.0,فله للبيع في نمار، الرياض,نمار، غرب الرياض، الرياض,حي نمار,الرياض
S962761792,شقة,3.0,3.0,102.0,1290000.0,شقة للبيع في  العارض، شمال الرياض,العارض، شمال الرياض، الرياض,حي العارض,الرياض
V887690277,دور,4.0,3.0,177.0,700000.0,دور للبيع في بدر، جنوب الرياض,بدر، جنوب الرياض، الرياض,حي بدر,الرياض
M545814286,فیلا,3.0,4.0,960.0,7680000.0,فيلا للبيع في الرحمانية، شمال الرياض,الرحمانية، شمال الرياض، الرياض,حي الرحمانية,الرياض
N881587363,دور,5.0,5.0,186.0,1145000.0,دور للبيع في الرمال، شرق الرياض,الرمال، شرق الرياض، الرياض,حي الرمال,الرياض
B217404693,دور,3.0,3.0,250.0,950000.0,دور للبيع في في شبرا، غرب الرياض,شبرا، غرب الرياض، الرياض,حي شبرا,الرياض
P065916465,فیلا,11.0,10.0,634.0,4500000.0,فيلا للبيع في حي الورود، شمال الرياض,الورود، شمال الرياض، الرياض,حي الورود,الرياض
P538089990,دور,4.0,4.0,177.0,700000.0,دور للبيع في بدر، جنوب الرياض,بدر، جنوب الرياض، الرياض,حي بدر,الرياض
T890777415,عمارة سكنية,0.0,0.0,4000.0,6000000.0,عماره للبيع في المنصورية، جنوب الرياض,المنصورية، جنوب الرياض، الرياض,حي المنصورية,الرياض
E093712575,شقة,3.0,3.0,88.0,797000.0,للبيع شقق سكنية في القادسية، شرق الرياض,القادسية، شرق الرياض، الرياض,حي القادسية,الرياض
H321018365,فیلا,8.0,7.0,200.0,1800000.0,فيلا للبيع في المهدية، غرب الرياض,المهدية، غرب الرياض، الرياض,حي المهدية,الرياض
K335786059,فیلا,5.0,5.0,400.0,2850000.0,للبيع فيلا في المونسية، شرق الرياض,المونسية، شرق الرياض، الرياض,حي المونسية,الرياض
Y556014754,فیلا,7.0,5.0,625.0,1500000.0,فيلا للبيع في العريجاء الوسطى، غرب الرياض,العريجاء الوسطى، غرب الرياض، الرياض,حي العريجاء الوسطى,الرياض
J823235116,فیلا,5.0,5.0,450.0,3250000.0,"فيلا مودرن للبيع في المهدية, غرب الرياض",المهدية، غرب الرياض، الرياض,حي المهدية,الرياض
Z640314352,دور,4.0,3.0,550.0,1400000.0,دور للبيع في العارض، شمال الرياض,العارض، شمال الرياض، الرياض,حي العارض,الرياض
C035736981,دور,4.0,5.0,246.0,1800000.0,دور للبيع في العارض، شمال الرياض,العارض، شمال الرياض، الرياض,حي العارض,الرياض
X160148806,فیلا,8.0,6.0,400.0,2250000.0,فيلا دبلوكس للبيع في المهدية، غرب الرياض,المهدية، غرب الرياض، الرياض,حي المهدية,الرياض
R101887753,فیلا,8.0,6.0,400.0,2250000.0,فيلا دوبلكس للبيع في المهدية، غرب الرياض,المهدية، غرب الرياض، الرياض,حي المهدية,الرياض
I468237196,شقة,3.0,4.0,124.0,580000.0,شقة للبيع في السويدي، غرب الرياض,السويدي، غرب الرياض، الرياض,حي السويدي,الرياض
Y149723898,شقة,3.0,3.0,180.0,685000.0,شقة للبيع في العوالي، غرب الرياض,العوالي، غرب الرياض، الرياض,حي العوالي,الرياض
U850549264,شقة,3.0,3.0,177.0,450000.0,شقة للبيع في بدر، جنوب الرياض,بدر، جنوب الرياض، الرياض,حي بدر,الرياض
L074971415,فیلا,9.0,6.0,375.0,3400000.0,فيلا للبيع في اليرموك، شرق الرياض,اليرموك، شرق الرياض، الرياض,حي اليرموك,الرياض
C463004890,فیلا,4.0,3.0,375.0,3400000.0,فيلا للبيع في اليرموك، شرق الرياض,اليرموك، شرق الرياض، الرياض,حي اليرموك,الرياض
H074971415,فیلا,9.0,6.0,375.0,3400000.0,فيلا للبيع في اليرموك، شرق الرياض,اليرموك، شرق الرياض، الرياض,حي اليرموك,الرياض
O074971415,فیلا,9.0,6.0,375.0,3400000.0,فيلا للبيع في اليرموك، شرق الرياض,اليرموك، شرق الرياض، الرياض,حي اليرموك,الرياض
Z746604801,شقة,4.0,3.0,125.0,650000.0,شقة 4 غرف نوم للبيع ظهرة لبن، الرياض,ظهرة لبن، غرب الرياض، الرياض,حي ظهرة لبن,الرياض
Q869780397,فیلا,7.0,6.0,225.0,1750000.0,فيلا للبيع في الرمال، شرق الرياض,الرمال، شرق الرياض، الرياض,حي الرمال,الرياض
N999398956,فیلا,7.0,6.0,225.0,1750000.0,فيلا - الرياض - الرمال,الرمال، شرق الرياض، الرياض,حي الرمال,الرياض
T259231924,دور,5.0,4.0,177.0,950000.0,دور للبيع في الرمال، شرق الرياض,الرمال، شرق الرياض، الرياض,حي الرمال,الرياض
R633643996,دور,3.0,3.0,227.0,780000.0,ادوار ارضيه وعلويه حي العزيزيه,العزيزية، جنوب الرياض، الرياض,حي العزيزية,الرياض
B259231924,دور,5.0,4.0,177.0,950000.0,دور للبيع في الرمال، شرق الرياض,الرمال، شرق الرياض، الرياض,حي الرمال,الرياض
M272485778,دور,5.0,3.0,145.0,730000.0,"دور للبيع في الحزم, غرب الرياض",الحزم، غرب الرياض، الرياض,حي الحزم,الرياض
I160785980,دور,5.0,4.0,146.0,900000.0,"دور للبيع في الرمال, شرق الرياض",الرمال، شرق الرياض، الرياض,حي الرمال,الرياض
B761598944,دور,3.0,3.0,145.0,730000.0,"دور للبيع في الحزم, غرب الرياض",الحزم، غرب الرياض، الرياض,حي الحزم,الرياض
Q585712918,شقة,4.0,3.0,88.0,797000.0,شقة بفيلا للبيع في القادسية، شرق الرياض,القادسية، شرق الرياض، الرياض,حي القادسية,الرياض
D291346134,دور,4.0,4.0,212.0,900000.0,دور للبيع في القادسيه، شرق الرياض,القادسية، شرق الرياض، الرياض,حي القادسية,الرياض
S938304256,دور,4.0,4.0,199.0,900000.0,للبيع دور أول في القادسية، شرق الرياض,القادسية، شرق الرياض، الرياض,حي القادسية,الرياض
O873792046,دور,3.0,5.0,202.0,660000.0,منزل جميل,طيبة، جنوب الرياض، الرياض,حي طيبة,الرياض
M925612559,دور,3.0,5.0,202.0,660000.0,منزا جميل جدا,طيبة، جنوب الرياض، الرياض,حي طيبة,الرياض
B968186191,دور,3.0,5.0,202.0,660000.0,منزل جميل ومريح جدا,طيبة، جنوب الرياض، الرياض,حي طيبة,الرياض
V753324851,دور,3.0,5.0,202.0,660000.0,منزل جميل وجديد,طيبة، جنوب الرياض، الرياض,حي طيبة,الرياض
Y892714520,شقة,3.0,4.0,159.0,905000.0,شقة فاخرة للبيع في القادسية، شرق الرياض,القادسية، شرق الرياض، الرياض,حي القادسية,الرياض
Q898506068,دور,4.0,4.0,305.0,1400000.0,دور أرضي مودرن للبيع في القادسية، شرق الرياض,القادسية، شرق الرياض، الرياض,حي القادسية,الرياض
R218304194,دور,3.0,3.0,196.0,950000.0,"دور للبيع في حي الرمال, شرق الرياض",الرمال، شرق الرياض، الرياض,حي الرمال,الرياض
M108631986,دور,4.0,3.0,180.0,850000.0,دور للبيع في حي الرمال، شرق الرياض,الرمال، شرق الرياض، الرياض,حي الرمال,الرياض
F991229967,دور,4.0,3.0,176.0,740000.0,دور للبيع في بدر، جنوب الرياض,بدر، جنوب الرياض، الرياض,حي بدر,الرياض
B393659446,فیلا,8.0,7.0,260.0,2600000.0,فيلا - الرياض - حي المونسية,المونسية، شرق الرياض، الرياض,حي المونسية,الرياض
W219796645,فیلا,8.0,6.0,285.0,1850000.0,فيلا - الرياض - حي القادسية,القادسية، شرق الرياض، الرياض,حي القادسية,الرياض
N137470374,دور,5.0,5.0,250.0,920000.0,دور للبيع في ديراب، غرب الرياض,ديراب، غرب الرياض، الرياض,حي ديراب,الرياض
P235529688,عمارة سكنية,0.0,0.0,500.0,550000.0,مبنى سكني للبيع في الزهرة، الرياض,الزهرة، غرب الرياض، الرياض,حي الزهرة,الرياض
K325534928,عمارة سكنية,0.0,0.0,500.0,600000.0,عمارة للبيع في الزهرة، الرياض,الزهرة، غرب الرياض، الرياض,حي الزهرة,الرياض
Q999556137,فیلا,3.0,3.0,200.0,1950000.0,فيلا للبيع في حي سدرة بالرياض,حي السدره، شمال الرياض، الرياض,حي حي السدره,الرياض
H213544844,فیلا,10.0,9.0,432.0,3300000.0,فيلا للبيع في  المهدية، غرب الرياض,المهدية، غرب الرياض، الرياض,حي المهدية,الرياض
H923672707,فیلا,10.0,8.0,450.0,3200000.0,للبيع فيلا مودرن بالمهديه المربع الذهبي مع شقه بمدخل خاص,المهدية، غرب الرياض، الرياض,حي المهدية,الرياض
W661355081,دور,3.0,3.0,228.0,600000.0,"دور للبيع في بدر, جنوب الرياض",بدر، جنوب الرياض، الرياض,حي بدر,الرياض
I855404107,ارض سكنية,0.0,0.0,368.0,850000.0,للبيع ارض في  مخطط الخير، شمال الرياض,الرياض,حي الرياض,الرياض
G825786929,ارض,0.0,0.0,777.0,2000000.0,أرض للبيع في الخير,الرياض,حي الرياض,الرياض
H552023687,فیلا,10.0,11.0,525.0,11000000.0,فيلا للبيع,الملقا، شمال الرياض، الرياض,حي الملقا,الرياض
C152412534,شقة,3.0,3.0,389.0,840000.0,شقة ملحق للبيع في لزهرة، غرب الرياض,الزهرة، غرب الرياض، الرياض,حي الزهرة,الرياض
C324114034,دور,3.0,3.0,503.0,1680000.0,"دور للبيع في المونسية, شرق الرياض",المونسية، شرق الرياض، الرياض,حي المونسية,الرياض
Z221743073,دور,4.0,4.0,297.0,590000.0,دور للبيع في العزيزية، جنوب الرياض,العزيزية، جنوب الرياض، الرياض,حي العزيزية,الرياض
R691087251,ارض سكنية,0.0,0.0,446.0,4200000.0,فيلا قديمة للبيع في الورود، شمال الرياض,الورود، شمال الرياض، الرياض,حي الورود,الرياض
J819851701,فیلا,5.0,4.0,352.0,2600000.0,فيلا للبيع في الرمال، شرق الرياض,الرمال، شرق الرياض، الرياض,حي الرمال,الرياض
R566021510,ارض سكنية,0.0,0.0,300.0,660000.0,أرض للبيع في الوسام، الرياض,الوسام، الرياض,حي الوسام,الرياض
N556870385,ارض سكنية,0.0,0.0,375.0,2400.0,ارض للبيع سكنية في حي الجنادرية، الرياض,الجنادرية، شرق الرياض، الرياض,حي الجنادرية,الرياض
F705072303,فیلا,7.0,6.0,560.0,7000000.0,فيلا للبيع في الملقا، شمال الرياض,الملقا، شمال الرياض، الرياض,حي الملقا,الرياض
A197120762,فیلا,3.0,4.0,900.0,1300000.0,"فيلا للبيع في ظهرة لبن, غرب الرياض",ظهرة لبن، غرب الرياض، الرياض,حي ظهرة لبن,الرياض
Y288795228,ارض سكنية,0.0,0.0,300.0,600000.0,أرض سكنية للبيع في الوسام، الرياض,الوسام، الرياض,حي الوسام,الرياض
A922756313,ارض سكنية,0.0,0.0,300.0,660000.0,أرض سكنية للبيع في الرحاب، شرق الرياض,السحاب، الرياض,حي السحاب,الرياض
L262783085,دور,2.0,3.0,296.0,1550000.0,دور للبيع في الرمال، شرق الرياض,الرمال، شرق الرياض، الرياض,حي الرمال,الرياض
A494818846,فیلا,6.0,5.0,375.0,1300000.0,"فيلا للبيع في بدر, جنوب الرياض",بدر، جنوب الرياض، الرياض,حي بدر,الرياض
Y058444275,دور,3.0,4.0,200.0,1850000.0,"دور للبيع في قرطبة, شرق الرياض",قرطبة، شرق الرياض، الرياض,حي قرطبة,الرياض
H176548971,فیلا,6.0,5.0,825.0,8000000.0,فيلا للبيع في المغرزات، شمال الرياض,المغرزات، شمال الرياض، الرياض,حي المغرزات,الرياض
K277557451,عمارة سكنية,0.0,0.0,172.0,800000.0,عمارة سكنية للبيع في الرمال، شرق الرياض,الرمال، شرق الرياض، الرياض,حي الرمال,الرياض
