Property_ID,Property Type,Bedrooms,Bathrooms,Area,Price,Description,Location,District,City
T744104276,شقة,3.0,3.0,131.0,420000.0,شقة للبيع في الدار البيضاء، جنوب الرياض,الدار البيضاء، جنوب الرياض، الرياض,حي الدار البيضاء,الرياض
R444987673,دور,3.0,4.0,500.0,860000.0,دور للبيع في شبرا، غرب الرياض,شبرا، غرب الرياض، الرياض,حي شبرا,الرياض
U744104276,شقة,3.0,3.0,131.0,420000.0,شقة للبيع في الدار البيضاء، جنوب الرياض,الدار البيضاء، جنوب الرياض، الرياض,حي الدار البيضاء,الرياض
U829436455,دور,3.0,3.0,500.0,860000.0,دور للبيع في شبرا، غرب الرياض,شبرا، غرب الرياض، الرياض,حي شبرا,الرياض
H597014406,فیلا,5.0,6.0,204.0,715000.0,فيلا 5 غرف نوم للبيع في الشفاء، الرياض,الشفا، جنوب الرياض، الرياض,حي الشفا,الرياض
F480591827,دور,5.0,3.0,180.0,539000.0,دور للبيع في بدر، جنوب الرياض,بدر، جنوب الرياض، الرياض,حي بدر,الرياض
L464488018,دور,4.0,3.0,143.0,670000.0,دور للبيع في شارع محمد بن عوجان ، حي الحزم ، الرياض ، منطقة الرياض,الحزم، غرب الرياض، الرياض,حي الحزم,الرياض
R382055350,شقة,3.0,3.0,150.0,670000.0,شقة للبيع في العوالي، غرب الرياض,العوالي، غرب الرياض، الرياض,حي العوالي,الرياض
K437468023,شقة,4.0,3.0,234.0,820000.0,شقة للبيع في العوالي، غرب الرياض,العوالي، غرب الرياض، الرياض,حي العوالي,الرياض
R643048236,شقة,4.0,4.0,154.0,679997.0,شقة للبيع في ضاحية نمار، غرب الرياض,ضاحية نمار، غرب الرياض، الرياض,حي ضاحية نمار,الرياض
R397200880,دور,3.0,3.0,149.0,1300000.0,دور للبيع في المونسية، شرق الرياض,المونسية، شرق الرياض، الرياض,حي المونسية,الرياض
W273414355,شقة,3.0,3.0,219.0,690000.0,"شقة للبيع في العزيزية, جنوب الرياض",العزيزية، جنوب الرياض، الرياض,حي العزيزية,الرياض
O865616259,فیلا,7.0,4.0,200.0,4000000.0,فيلا للبيع في مطار الملك خالد الدولي، شمال الرياض,مطار الملك خالد الدولي، شمال الرياض، الرياض,حي مطار الملك خالد الدولي,الرياض
L517940153,شقة,3.0,3.0,177.0,450000.0,شقة للبيع في حي بدر، جنوب الرياض,بدر، جنوب الرياض، الرياض,حي بدر,الرياض
R253138888,ارض سكنية,0.0,0.0,1123.0,1459900.0,أرض سكنية للبيع في المصفاة، جنوب الرياض,المصفاة، جنوب الرياض، الرياض,حي المصفاة,الرياض
F039171964,فیلا,8.0,4.0,342.0,1500000.0,"Villa for sale in Naseem Al Sharqi, Riyadh",النسيم الشرقي، شرق الرياض، الرياض,حي النسيم الشرقي,الرياض
Q872661811,استراحة,2.0,1.0,449.0,1400000.0,"استراحة للبيع في شارع حوصاء, حي نمار, مدينة الرياض, منطقة الرياض",نمار، غرب الرياض، الرياض,حي نمار,الرياض
H791401191,دور,4.0,5.0,300.0,900000.0,دور للبيع في القادسيه، شرق الرياض,القادسية، شرق الرياض، الرياض,حي القادسية,الرياض
B710699273,فیلا,6.0,6.0,300.0,2200000.0,"فيلا للبيع في القادسية, شرق الرياض",القادسية، شرق الرياض، الرياض,حي القادسية,الرياض
Y339327109,شقة,3.0,3.0,131.0,420000.0,شقة للبيع في الدار البيضاء، جنوب الرياض,الدار البيضاء، جنوب الرياض، الرياض,حي الدار البيضاء,الرياض
M542594670,دور,3.0,4.0,500.0,860000.0,"دور للبيع في شبرا, غرب الرياض",شبرا، غرب الرياض، الرياض,حي شبرا,الرياض
F124260026,دور,3.0,3.0,500.0,800000.0,أدوار للبيع في شبرا، غرب الرياض,شبرا، غرب الرياض، الرياض,حي شبرا,الرياض
J571401130,دور,3.0,3.0,500.0,860000.0,أدوار للبيع في الزهرة، شرق الرياض,الزهرة، غرب الرياض، الرياض,حي الزهرة,الرياض
L538484379,دور,4.0,4.0,214.0,760000.0,"دور للبيع في بدر, جنوب الرياض",بدر، جنوب الرياض، الرياض,حي بدر,الرياض
Y567044536,دور,3.0,3.0,500.0,800000.0,دور للبيع في  شبرا، غرب الرياض,شبرا، غرب الرياض، الرياض,حي شبرا,الرياض
J954293444,شقة,3.0,4.0,124.0,580000.0,شقة للبيع في  السويدي، غرب الرياض,السويدي، غرب الرياض، الرياض,حي السويدي,الرياض
R458966720,شقة,3.0,3.0,149.0,430000.0,شقق للبيع في بدر، جنوب الرياض,بدر، جنوب الرياض، الرياض,حي بدر,الرياض
K227357238,دور,4.0,4.0,214.0,760000.0,دور للبيع في  السويدي، غرب الرياض,بدر، جنوب الرياض، الرياض,حي بدر,الرياض
Y952751472,دور,3.0,3.0,500.0,800000.0,أدوار للبيع في شبرا، غرب الرياض,شبرا، غرب الرياض، الرياض,حي شبرا,الرياض
M339882301,دور,4.0,4.0,500.0,800000.0,"دور للبيع في شبرا, غرب الرياض",شبرا، غرب الرياض، الرياض,حي شبرا,الرياض
W825079379,فیلا,6.0,5.0,285.0,4400000.0,"فيلا للبيع في النرجس, شمال الرياض",النرجس، شمال الرياض، الرياض,حي النرجس,الرياض
A114096741,فیلا,3.0,5.0,200.0,3400000.0,وريف هاوس 39 بحي النرجس,النرجس، شمال الرياض، الرياض,حي النرجس,الرياض
Q597766326,دور,4.0,3.0,158.0,800000.0,دور للبيع في السعادة، شرق الرياض,السعادة، شرق الرياض، الرياض,حي السعادة,الرياض
Y159875236,شقة,3.0,2.0,70.0,750000.0,شقة للبيع في  السعادة، شرق الرياض,السعادة، شرق الرياض، الرياض,حي السعادة,الرياض
L738541094,فیلا,6.0,4.0,600.0,1600000.0,دوبليكس درج داخلي وشقة بحي الجنادرية,الجنادرية، شرق الرياض، الرياض,حي الجنادرية,الرياض
J782901906,فیلا,6.0,6.0,250.0,2400000.0,"فيلا للبيع في المونسية, شرق الرياض",المونسية، شرق الرياض، الرياض,حي المونسية,الرياض
M638163916,دور,4.0,3.0,220.0,1200000.0,"دور علوي للبيع في الرمال, شرق الرياض",الرمال، شرق الرياض، الرياض,حي الرمال,الرياض
U723850964,فیلا,5.0,7.0,600.0,3500000.0,"فيلا دوبلكس للبيع في قرطبة, شرق الرياض",قرطبة، شرق الرياض، الرياض,حي قرطبة,الرياض
E010723547,شقة,4.0,3.0,89.0,800000.0,"للبيع شقه مع سطح في القادسية, شرق الرياض",القادسية، شرق الرياض، الرياض,حي القادسية,الرياض
C629910830,ارض,0.0,0.0,377.0,2639000.0,أرض للبيع في العارض، شمال الرياض,العارض، شمال الرياض، الرياض,حي العارض,الرياض
G354005143,فیلا,7.0,8.0,250.0,1800000.0,فيلا دوبلكس للبيع في ظهرة لبن، غرب الرياض,ظهرة لبن، غرب الرياض، الرياض,حي ظهرة لبن,الرياض
L732633766,شقة,4.0,3.0,141.0,2912000.0,"شقة للبيع في برج داماك العليا, شمال الرياض",العليا، شمال الرياض، الرياض,حي العليا,الرياض
W255658749,شقة,3.0,3.0,893.0,590000.0,شقة للبيع في ظهرة لبن، غرب الرياض,ظهرة لبن، غرب الرياض، الرياض,حي ظهرة لبن,الرياض
K998640712,شقة,3.0,3.0,750.0,650000.0,شقة 3 غرف نوم للبيع في النسيم الغربي، الرياض,النسيم الغربي، شرق الرياض، الرياض,حي النسيم الغربي,الرياض
X826648666,شقة,3.0,3.0,124.0,580000.0,شقة للبيع في  السويدي، غرب الرياض,السويدي، غرب الرياض، الرياض,حي السويدي,الرياض
B554727661,دور,4.0,4.0,214.0,760000.0,دور للبيع في بدر، جنوب الرياض,بدر، جنوب الرياض، الرياض,حي بدر,الرياض
L893657956,شقة,4.0,4.0,131.0,420000.0,"شقة للبيع في الدار البيضاء, جنوب الرياض",الدار البيضاء، جنوب الرياض، الرياض,حي الدار البيضاء,الرياض
Z473176340,شقة,3.0,3.0,131.0,400000.0,شقة للبيع في الدار البيضاء، جنوب الرياض,الدار البيضاء، جنوب الرياض، الرياض,حي الدار البيضاء,الرياض
K157474199,شقة,3.0,3.0,131.0,430000.0,شقق للبيع في بدر، جنوب الرياض,بدر، جنوب الرياض، الرياض,حي بدر,الرياض
H557985808,دور,4.0,4.0,214.0,760000.0,دور للبيع في بدر، جنوب الرياض,بدر، جنوب الرياض، الرياض,حي بدر,الرياض
I557985808,دور,4.0,4.0,214.0,760000.0,دور للبيع في بدر، جنوب الرياض,بدر، جنوب الرياض، الرياض,حي بدر,الرياض
K562231889,دور,4.0,4.0,214.0,760000.0,دور علوي للبيع في بدر، جنوب الرياض,بدر، جنوب الرياض، الرياض,حي بدر,الرياض
X807103044,شقة,4.0,4.0,177.0,690000.0,شقة للبيع في  بدر، جنوب الرياض,بدر، جنوب الرياض، الرياض,حي بدر,الرياض
F689471085,شقة,3.0,3.0,131.0,430000.0,شقة للبيع في بدر، جنوب الرياض,بدر، جنوب الرياض، الرياض,حي بدر,الرياض
R491880034,فیلا,6.0,5.0,336.0,3000000.0,فيلا 6 غرف نوم للبيع في العارض، الرياض,العارض، شمال الرياض، الرياض,حي العارض,الرياض
N456738614,دور,3.0,3.0,639.0,690000.0,دور وشقق في حي الدار البيضاء الرياض للبيع,الدار البيضاء، جنوب الرياض، الرياض,حي الدار البيضاء,الرياض
W332938144,ارض سكنية,0.0,0.0,298.0,780000.0,"أرض للبيع في مخطط الخير, شمال الرياض",مخطط الخير، شمال الرياض، الرياض,حي مخطط الخير,الرياض
D506667389,شقة,1.0,1.0,91.0,2425150.0,للبيع شقة فاخرة ببرج داماك في العليا، شمال الرياض,العليا، شمال الرياض، الرياض,حي العليا,الرياض
X707770754,فیلا,4.0,5.0,225.0,1750000.0,فيلا دوبلكس للبيع في الرمال، شرق الرياض,الرمال، شرق الرياض، الرياض,حي الرمال,الرياض
P876759574,فیلا,6.0,5.0,225.0,2300000.0,"فيلا للبيع في المهدية, غرب الرياض",المهدية، غرب الرياض، الرياض,حي المهدية,الرياض
M371420028,فیلا,5.0,5.0,337.0,1600000.0,فيلا للبيع في النظيم، شرق الرياض,النظيم، شرق الرياض، الرياض,حي النظيم,الرياض
B540439350,دور,3.0,2.0,172.0,1050000.0,دور للبيع في الرمال، شرق الرياض,الرمال، شرق الرياض، الرياض,حي الرمال,الرياض
B060602790,ارض سكنية,0.0,0.0,442.0,6000.0,أرض سكنية للبيع في العارض، شمال الرياض,العارض، شمال الرياض، الرياض,حي العارض,الرياض
F492850134,دور,5.0,3.0,540.0,1250000.0,"دور للبيع في الرمال, شرق الرياض",الرمال، شرق الرياض، الرياض,حي الرمال,الرياض
S763294776,ارض سكنية,0.0,0.0,375.0,800000.0,أرض سكنية للبيع في الرياض,الرياض,حي الرياض,الرياض
W149723898,شقة,3.0,3.0,180.0,685000.0,شقة للبيع في العوالي، غرب الرياض,العوالي، غرب الرياض، الرياض,حي العوالي,الرياض
P070056079,فیلا,3.0,3.0,418.0,3500000.0,"فيلا للبيع في المهدية, غرب الرياض",المهدية، غرب الرياض، الرياض,حي المهدية,الرياض
F798699983,دور,3.0,3.0,250.0,800000.0,دور للبيع في شبرا، غرب الرياض,شبرا، غرب الرياض، الرياض,حي شبرا,الرياض
S132949090,ارض سكنية,0.0,0.0,957.0,900000.0,أرض للبيع في الزاهر، الرياض,الزاهر، الرياض,حي الزاهر,الرياض
G473176340,شقة,3.0,3.0,131.0,400000.0,شقة للبيع في الدار البيضاء، جنوب الرياض,الدار البيضاء، جنوب الرياض، الرياض,حي الدار البيضاء,الرياض
K151414340,دور,4.0,4.0,214.0,760000.0,"دور للبيع في بدر, جنوب الرياض",بدر، جنوب الرياض، الرياض,حي بدر,الرياض
D805731001,دور,4.0,4.0,214.0,760000.0,أدوار للبيع في بدر، جنوب الرياض,بدر، جنوب الرياض، الرياض,حي بدر,الرياض
T891178646,دور,3.0,3.0,214.0,760000.0,دور للبيع في  بدر، جنوب الرياض,بدر، جنوب الرياض، الرياض,حي بدر,الرياض
P018925967,دور,4.0,4.0,214.0,760000.0,أدوار للبيع في بدر، جنوب الرياض,بدر، جنوب الرياض، الرياض,حي بدر,الرياض
F157474199,شقة,3.0,3.0,131.0,430000.0,شقق للبيع في بدر، جنوب الرياض,بدر، جنوب الرياض، الرياض,حي بدر,الرياض
T850495412,دور,4.0,4.0,214.0,760000.0,حي بدر,بدر، جنوب الرياض، الرياض,حي بدر,الرياض
I374179635,شقة,3.0,3.0,178.0,450000.0,شقة للبيع في  بدر، جنوب الرياض,بدر، جنوب الرياض، الرياض,حي بدر,الرياض
K531194349,دور,4.0,3.0,500.0,860000.0,أدوار للبيع في الزهرة، غرب الرياض,الزهرة، غرب الرياض، الرياض,حي الزهرة,الرياض
O618786398,شقة,3.0,3.0,120.0,969000.0,الروضه,الروضة، شرق الرياض، الرياض,حي الروضة,الرياض
J532891007,شقة,2.0,3.0,118.0,1600000.0,شقه للبيع في النخيل، شمال الرياض,النخيل، شمال الرياض، الرياض,حي النخيل,الرياض
D621869354,ارض سكنية,0.0,0.0,750.0,550.0,أرض سكنية للبيع في الشعلة، الرياض,الشعلة، الرياض,حي الشعلة,الرياض
P879931806,دور,4.0,4.0,163.0,690000.0,دور للبيع في الشفاء، جنوب الرياض,الشفا، جنوب الرياض، الرياض,حي الشفا,الرياض
V004642312,فیلا,4.0,5.0,273.0,1850000.0,فيلا للبيع في الرمال، شرق الرياض,الرمال، شرق الرياض، الرياض,حي الرمال,الرياض
W893099694,دور,3.0,3.0,141.0,1100000.0,دور للبيع في المونسية، شرق الرياض,المونسية، شرق الرياض، الرياض,حي المونسية,الرياض
T035875077,دور,3.0,3.0,540.0,1280000.0,دور للبيع في المونسية، شرق الرياض,المونسية، شرق الرياض، الرياض,حي المونسية,الرياض
D422179109,دور,2.0,3.0,250.0,860000.0,دور للبيع في شبرا، غرب الرياض,شبرا، غرب الرياض، الرياض,حي شبرا,الرياض
B001521619,فیلا,10.0,7.0,434.0,3400000.0,"فيلا للبيع في العارض, شمال الرياض",العارض، شمال الرياض، الرياض,حي العارض,الرياض
L299443289,شقة,2.0,2.0,68.0,700000.0,"شقة للبيع في الرمال, شرق الرياض",الرمال، شرق الرياض، الرياض,حي الرمال,الرياض
H742881690,دور,6.0,5.0,222.0,1200000.0,دور أرضي للبيع في القادسية، شرق الرياض,القادسية، شرق الرياض، الرياض,حي القادسية,الرياض
E846041562,دور,6.0,5.0,199.0,900000.0,دور أول للبيع في القادسية، شرق الرياض,القادسية، شرق الرياض، الرياض,حي القادسية,الرياض
E248501972,شقة,4.0,3.0,88.0,797000.0,شقه مع سطح بحي القادسية بسعر مميز,القادسية، شرق الرياض، الرياض,حي القادسية,الرياض
B537248917,شقة,3.0,3.0,88.0,797000.0,شقه بفيلا للبيع بحي القادسية,القادسية، شرق الرياض، الرياض,حي القادسية,الرياض
F859173360,دور,4.0,5.0,222.0,1200000.0,دور ارضي للبيع بحي القادسية,القادسية، شرق الرياض، الرياض,حي القادسية,الرياض
P012499282,دور,3.0,3.0,600.0,1950000.0,"دور للبيع في قرطبة, شرق الرياض",قرطبة، شرق الرياض، الرياض,حي قرطبة,الرياض
G841946789,دور,4.0,4.0,214.0,760000.0,حي بدر,بدر، جنوب الرياض، الرياض,حي بدر,الرياض
A107478003,شقة,3.0,3.0,150.0,650000.0,شقة للبيع في العوالي، غرب الرياض,العوالي، غرب الرياض، الرياض,حي العوالي,الرياض
O329973034,فیلا,5.0,5.0,300.0,3400000.0,فيلا للبيع في الصحافة، شمال الرياض,الصحافة، شمال الرياض، الرياض,حي الصحافة,الرياض
Z886181510,شقة,3.0,2.0,115.0,505000.0,"شقة للبيع في طويق, غرب الرياض",طويق، غرب الرياض، الرياض,حي طويق,الرياض
A357685465,فیلا,5.0,5.0,300.0,3400000.0,فيلا للبيع في الصحافة، شمال الرياض,الصحافة، شمال الرياض، الرياض,حي الصحافة,الرياض
H252363233,شقة,3.0,3.0,182.0,790000.0,شقة للبيع في الرمال، شرق الرياض,الرمال، شرق الرياض، الرياض,حي الرمال,الرياض
L212444976,شقة,3.0,3.0,122.0,753000.0,"شقة للبيع في القادسية, شرق الرياض",القادسية، شرق الرياض، الرياض,حي القادسية,الرياض
E816549044,شقة,2.0,2.0,75.0,349000.0,شقة للبيع في ظهرة لبن، غرب الرياض,ظهرة لبن، غرب الرياض، الرياض,حي ظهرة لبن,الرياض
E744104276,شقة,3.0,3.0,131.0,420000.0,شقة للبيع في الدار البيضاء، جنوب الرياض,الدار البيضاء، جنوب الرياض، الرياض,حي الدار البيضاء,الرياض
Q698134700,شقة,3.0,3.0,478.0,880000.0,شقة مودرن للبيع في المهدية، غرب الرياض,المهدية، غرب الرياض، الرياض,حي المهدية,الرياض
G249518315,شقة,2.0,3.0,520.0,680000.0,🏢 شقة للبيع - حي النسيم، الصفوة 🏢,النسيم الشرقي، شرق الرياض، الرياض,حي النسيم الشرقي,الرياض
V231427600,فیلا,7.0,9.0,303.0,1150000.0,"فيلا للبيع في بدر, جنوب الرياض",بدر، جنوب الرياض، الرياض,حي بدر,الرياض
Z672372933,شقة,3.0,2.0,114.0,470000.0,"شقة للبيع في طويق, غرب الرياض",طويق، غرب الرياض، الرياض,حي طويق,الرياض
C129805584,دور,3.0,2.0,193.0,560000.0,أدوار للبيع في بدر، جنوب الرياض,بدر، جنوب الرياض، الرياض,حي بدر,الرياض
W649079503,شقة,3.0,3.0,140.0,770000.0,شقة فاخرة للبيع بحي القادسيه,القادسية، شرق الرياض، الرياض,حي القادسية,الرياض
Q202372716,شقة,5.0,3.0,170.0,1000000.0,"Apartment for sale in Al Ared district, Riyadh",العارض، شمال الرياض، الرياض,حي العارض,الرياض
N029955568,شقة,4.0,3.0,140.0,770000.0,للبيع شقة في القادسية، شرق الرياض,القادسية، شرق الرياض، الرياض,حي القادسية,الرياض
R924869646,دور,3.0,4.0,168.0,1050000.0,دور أرضي فخم للبيع في القادسية، شرق الرياض,القادسية، شرق الرياض، الرياض,حي القادسية,الرياض
P325510423,دور,3.0,3.0,168.0,1050000.0,دور ارضي للبيع في القادسية، شرق الرياض,القادسية، شرق الرياض، الرياض,حي القادسية,الرياض
G553542710,شقة,3.0,3.0,173.0,450000.0,"شقة للبيع في بدر, جنوب الرياض",بدر، جنوب الرياض، الرياض,حي بدر,الرياض
W825189476,دور,3.0,4.0,193.0,1000000.0,دور للبيع في القادسية، شرق الرياض,القادسية، شرق الرياض، الرياض,حي القادسية,الرياض
O072972509,دور,3.0,3.0,188.0,1350000.0,دور للبيع في المونسية، شرق الرياض,المونسية، شرق الرياض، الرياض,حي المونسية,الرياض
K051779014,فیلا,4.0,4.0,200.0,750000.0,فيلا للبيع في بدر، جنوب الرياض,بدر، جنوب الرياض، الرياض,حي بدر,الرياض
Z762940697,دور,4.0,4.0,245.0,2200000.0,للبيع دور في العقيق، شمال الرياض,العقيق، شمال الرياض، الرياض,حي العقيق,الرياض
E261615836,شقة,3.0,3.0,131.0,420000.0,"شقة للبيع في الدار البيضاء, جنوب الرياض",الدار البيضاء، جنوب الرياض، الرياض,حي الدار البيضاء,الرياض
P339327109,شقة,3.0,3.0,131.0,420000.0,شقة للبيع في الدار البيضاء، جنوب الرياض,الدار البيضاء، جنوب الرياض، الرياض,حي الدار البيضاء,الرياض
T339327109,شقة,3.0,3.0,131.0,420000.0,شقة للبيع في الدار البيضاء، جنوب الرياض,الدار البيضاء، جنوب الرياض، الرياض,حي الدار البيضاء,الرياض
S963886086,فیلا,4.0,3.0,300.0,3357000.0,للبيع فيلا في النرجس، شمال الرياض,النرجس، شمال الرياض، الرياض,حي النرجس,الرياض
M969603036,شقة,3.0,3.0,131.0,1017000.0,شقة للبيع في الشهداء، شرق الرياض,الشهداء، شرق الرياض، الرياض,حي الشهداء,الرياض
Z269526640,شقة,4.0,3.0,133.0,750000.0,شقة 4 غرف نوم للبيع ضحرة لبان ، الرياض,ظهرة لبن، غرب الرياض، الرياض,حي ظهرة لبن,الرياض
N362550709,شقة,3.0,4.0,137.0,1450000.0,شقة للبيع في الملقا، شمال الرياض,الملقا، شمال الرياض، الرياض,حي الملقا,الرياض
R542945943,شقة,3.0,3.0,145.0,640000.0,شقة للبيع في حي طويق، غرب الرياض,طويق، غرب الرياض، الرياض,حي طويق,الرياض
U883268093,فیلا,5.0,3.0,300.0,2850000.0,فيلا - الرياض - النرجس,النرجس، شمال الرياض، الرياض,حي النرجس,الرياض
K435466071,شقة,4.0,4.0,145.0,1325000.0,شقة 4 غرف نوم للبيع في العارض، الرياض,العارض، شمال الرياض، الرياض,حي العارض,الرياض
T538818769,دور,3.0,2.0,540.0,1050000.0,دور للبيع في الرمال، شرق الرياض,الرمال، شرق الرياض، الرياض,حي الرمال,الرياض
X401795822,شقة,3.0,3.0,122.0,695000.0,"شقة للبيع في القادسية, شرق الرياض",القادسية، شرق الرياض، الرياض,حي القادسية,الرياض
K668218110,دور,3.0,3.0,171.0,750000.0,دور للبيع في طويق، غرب الرياض,طويق، غرب الرياض، الرياض,حي طويق,الرياض
Y248607862,دور,3.0,2.0,61.0,920000.0,دور للبيع في النسيم الشرقي، شرق الرياض,النسيم الشرقي، شرق الرياض، الرياض,حي النسيم الشرقي,الرياض
Y179942045,استراحة,3.0,2.0,846.0,1200000.0,استراحة846م للبيع في مخططات الشرق بطريقة رماح الرياض,الزاهر، الرياض,حي الزاهر,الرياض
S870931699,دور,3.0,3.0,153.0,1100000.0,دور للبيع في اليرموك، شرق الرياض,اليرموك، شرق الرياض، الرياض,حي اليرموك,الرياض
H361283961,شقة,3.0,4.0,216.0,1373000.0,شقة للبيع في العارض، شمال الرياض,العارض، شمال الرياض، الرياض,حي العارض,الرياض
X097506543,دور,2.0,2.0,86.0,1100000.0,"دور للبيع في الريان, شرق الرياض",الريان، شرق الرياض، الرياض,حي الريان,الرياض
Y807571316,فیلا,10.0,10.0,600.0,2100000.0,فيلا مميزة جدا للبيع في النظيم، الرياض,النظيم، شرق الرياض، الرياض,حي النظيم,الرياض
