Property_ID,Property Type,Bedrooms,Bathrooms,Area,Price,Description,Location,District,City
A877409248,دور,6.0,5.0,214.0,730000.0,"دور للبيع في بدر, جنوب الرياض",بدر، جنوب الرياض، الرياض,حي بدر,الرياض
W448904463,فیلا,5.0,6.0,440.0,4800000.0,فيلا للبيع في الملك فهد، شمال الرياض,الملك فهد، شمال الرياض، الرياض,حي الملك فهد,الرياض
M187516680,فیلا,11.0,6.0,445.0,5000000.0,فيلا للبيع في الوادي، شمال الرياض,الوادي، شمال الرياض، الرياض,حي الوادي,الرياض
H808583263,دور,6.0,5.0,185.0,1200000.0,دور للبيع في  المونسية، شرق الرياض,المونسية، شرق الرياض، الرياض,حي المونسية,الرياض
T501925005,فیلا,6.0,6.0,300.0,980000.0,فيلا للبيع في  بدر، جنوب الرياض,بدر، جنوب الرياض، الرياض,حي بدر,الرياض
G622333075,دور,6.0,5.0,500.0,1249000.0,"دور للبيع في الخليج, شرق الرياض",الخليج، شرق الرياض، الرياض,حي الخليج,الرياض
L472435811,دور,5.0,4.0,523.0,1650000.0,للبيع أدوار في الريان، شرق الرياض,الريان، شرق الرياض، الرياض,حي الريان,الرياض
G066192381,دور,4.0,3.0,3098.0,1350000.0,✴️دور علوي مودرن للبيع - مشروع ذا بارك✴️,الربوة، وسط الرياض، الرياض,حي الربوة,الرياض
B566435343,دور,3.0,3.0,500.0,800000.0,دور للبيع في شبرا، غرب الرياض,شبرا، غرب الرياض، الرياض,حي شبرا,الرياض
S442527647,فیلا,5.0,5.0,500.0,3500000.0,فيلا للبيع في الملز، شرق الرياض,الملز، شرق الرياض، الرياض,حي الملز,الرياض
W111682250,ارض سكنية,0.0,0.0,390.0,9200000.0,"أرض للبيع في شارع حمزة بوقري, حي الخير, مدينة الرياض, منطقة الرياض",مخطط الخير، شمال الرياض، الرياض,حي مخطط الخير,الرياض
T586702253,عمارة سكنية,0.0,0.0,1200.0,5500000.0,"عمارة سكنية للبيع في حي الجرادية, غرب الرياض",الجرادية، غرب الرياض، الرياض,حي الجرادية,الرياض
T771872957,شقة,3.0,3.0,893.0,590000.0,شقة 3 غرف نوم للبيع في ظهرة لبن، الرياض,ظهرة لبن، غرب الرياض، الرياض,حي ظهرة لبن,الرياض
I151063802,دور,3.0,3.0,900.0,850000.0,دور للبيع في  العوالي، غرب الرياض,العوالي، غرب الرياض، الرياض,حي العوالي,الرياض
L680464272,دور,4.0,6.0,540.0,1450000.0,دور للبيع في المونسية، شرق الرياض,المونسية، شرق الرياض، الرياض,حي المونسية,الرياض
D254189383,دور,3.0,3.0,202.0,660000.0,دور للبيع في الطيبة، جنوب الرياض,طيبة، جنوب الرياض، الرياض,حي طيبة,الرياض
J275107714,فیلا,3.0,4.0,312.0,1000000.0,فيلا دورين مفصوله للبيع في العريجاء الرياض,العريجاء، غرب الرياض، الرياض,حي العريجاء,الرياض
N377810082,ارض سكنية,0.0,0.0,711.0,900.0,أرض سكنية للبيع في  الحائر، الرياض,الحائر، الرياض,حي الحائر,الرياض
C003958908,ارض سكنية,0.0,0.0,360.0,3000.0,أرض سكنية للبيع في  النسيم الغربي، شرق الرياض,النسيم الغربي، شرق الرياض، الرياض,حي النسيم الغربي,الرياض
X155815562,ارض سكنية,0.0,0.0,418.0,1800.0,ارض سكنية للبيع في  الجنادرية، شرق الرياض,الجنادرية، شرق الرياض، الرياض,حي الجنادرية,الرياض
N468384345,ارض سكنية,0.0,0.0,936.0,535.0,أرض سكنية للبيع في  العلا، الرياض,العلا، الرياض,حي العلا,الرياض
A311606968,ارض سكنية,0.0,0.0,900.0,1223.0,أرض سكنية للبيع في عريض الرياض,عريض، جنوب الرياض، الرياض,حي عريض,الرياض
F740062252,ارض سكنية,0.0,0.0,160.0,900.0,أرض سكنية للبيع في  الغنامية، جنوب الرياض,الغنامية، جنوب الرياض، الرياض,حي الغنامية,الرياض
W237753130,دور,8.0,2.0,103.0,280000.0,بيت شعبي مكون من  8 غرف نوم للبيع في المرقب، الرياض,المرقب، وسط الرياض، الرياض,حي المرقب,الرياض
H976566219,ارض سكنية,0.0,0.0,600.0,7200000.0,"أرض سكنية للبيع في القيروان, شمال الرياض",القيروان، شمال الرياض، الرياض,حي القيروان,الرياض
Z373191240,دور,3.0,3.0,500.0,800000.0,ادوار للبيع في  شبرا، غرب الرياض,شبرا، غرب الرياض، الرياض,حي شبرا,الرياض
O899275444,فیلا,5.0,9.0,450.0,3800000.0,فيلا زاوية درج داخلي وشقة للبيع في اليرموك، شرق الرياض,اليرموك، شرق الرياض، الرياض,حي اليرموك,الرياض
M430464573,شقة,4.0,4.0,118.0,630000.0,شقة للبيع في ظهرة لبن، غرب الرياض,ظهرة لبن، غرب الرياض، الرياض,حي ظهرة لبن,الرياض
W092745745,فیلا,8.0,7.0,580.0,6000000.0,للبيع فيلا مع شقة في الربيع، شمال الرياض,الربيع، شمال الرياض، الرياض,حي الربيع,الرياض
D089444658,دور,4.0,4.0,3098.0,1450000.0,"Ground floor for sale in Rabwah neighborhood, Riyadh",الربوة، وسط الرياض، الرياض,حي الربوة,الرياض
E273062078,شقة,4.0,3.0,3098.0,1100000.0,✴️شقة مودرن للبيع - مشروع ذا بارك✴️,الربوة، وسط الرياض، الرياض,حي الربوة,الرياض
A724019977,دور,4.0,4.0,214.0,760000.0,دور للبيع في  بدر، جنوب الرياض,بدر، جنوب الرياض، الرياض,حي بدر,الرياض
A689471085,شقة,3.0,3.0,131.0,430000.0,شقة للبيع في بدر، جنوب الرياض,بدر، جنوب الرياض، الرياض,حي بدر,الرياض
L866650018,شقة,3.0,3.0,131.0,420000.0,شقة للبيع في  الدار البيضاء، جنوب الرياض,الدار البيضاء، جنوب الرياض، الرياض,حي الدار البيضاء,الرياض
D266817233,شقة,3.0,3.0,125.0,880000.0,شقة  للبيع في العارض، الرياض,العارض، شمال الرياض، الرياض,حي العارض,الرياض
Y307883251,دور,3.0,5.0,540.0,1300000.0,دور للبيع في المونسية، شرق الرياض,المونسية، شرق الرياض، الرياض,حي المونسية,الرياض
X341668579,فیلا,5.0,6.0,440.0,4200000.0,فيلا زاوية للبيع في الربيع، شمال الرياض,الربيع، شمال الرياض، الرياض,حي الربيع,الرياض
Y094318912,شقة,3.0,3.0,114.0,470000.0,شقة للبيع في  طويق، غرب الرياض,طويق، غرب الرياض، الرياض,حي طويق,الرياض
A258985150,فیلا,6.0,3.0,450.0,2350000.0,فيلا للبيع في ظهرة لبن، غرب الرياض,ظهرة لبن، غرب الرياض، الرياض,حي ظهرة لبن,الرياض
B089101864,دور,4.0,3.0,500.0,860000.0,دور أرضي للبيع في شبرا، غرب الرياض,شبرا، غرب الرياض، الرياض,حي شبرا,الرياض
X403241518,دور,3.0,4.0,500.0,860000.0,أدوار للبيع في شبرا، غرب الرياض,شبرا، غرب الرياض، الرياض,حي شبرا,الرياض
S001619488,فیلا,5.0,3.0,359.0,2400000.0,فيلا للبيع في المهدية، غرب الرياض,المهدية، غرب الرياض، الرياض,حي المهدية,الرياض
I403364540,دور,3.0,3.0,191.0,1000000.0,"دور للبيع في حي الرمال, شرق الرياض",الرمال، شرق الرياض، الرياض,حي الرمال,الرياض
B506920439,دور,4.0,3.0,390.0,1750000.0,🏡✨  وحدات برواز النرجس - تجربة السكن الفاخر في قلب الرياض!,النرجس، شمال الرياض، الرياض,حي النرجس,الرياض
N608778655,شقة,4.0,3.0,144.0,1160000.0,شقة مميزة للبيع في أحياء راقية حي النرجس,النرجس، شمال الرياض، الرياض,حي النرجس,الرياض
V461137668,ارض سكنية,0.0,0.0,410.0,1400000.0,"أرض للبيع في العمل, وسط الرياض",العمل، وسط الرياض، الرياض,حي العمل,الرياض
W549549320,فیلا,9.0,7.0,450.0,2800000.0,فيلا 11 غرفة نوم للبيع في ظهرة لبن، الرياض,ظهرة لبن، غرب الرياض، الرياض,حي ظهرة لبن,الرياض
L644597154,دور,4.0,4.0,174.0,680000.0,دور للبيع في السويدي، غرب الرياض,السويدي، غرب الرياض، الرياض,حي السويدي,الرياض
P594943733,عمارة,0.0,0.0,174.0,600000.0,"شقق للبيع في السويدي, غرب الرياض",السويدي، غرب الرياض، الرياض,حي السويدي,الرياض
E987144297,ارض سكنية,0.0,0.0,432.0,7000.0,🌟  أرض مميزة للبيع في حي العارض – الرياض  |  فرصة استثمارية لا تعوّض!,العارض، شمال الرياض، الرياض,حي العارض,الرياض
H817259233,شقة,3.0,3.0,168.0,450000.0,شقة للبيع في بدر، جنوب الرياض,بدر، جنوب الرياض، الرياض,حي بدر,الرياض
R761289942,شقة,3.0,3.0,128.0,550000.0,"شقة للبيع في الزهرة, غرب الرياض",الزهرة، غرب الرياض، الرياض,حي الزهرة,الرياض
H683029149,دور,3.0,3.0,500.0,800000.0,ادوار بصك حي السويدي,شبرا، غرب الرياض، الرياض,حي شبرا,الرياض
U008630173,ارض سكنية,0.0,0.0,450.0,2700000.0,أرض سكنية للبيع في العارض، شمال الرياض,العارض، شمال الرياض، الرياض,حي العارض,الرياض
B603367921,شقة,3.0,3.0,113.0,950000.0,شقة للبيع في حي النرجس،,النرجس، شمال الرياض، الرياض,حي النرجس,الرياض
T346946457,فیلا,5.0,4.0,400.0,3500000.0,فيلا فاخرة للبيع في المهدية، غرب الرياض,المهدية، غرب الرياض، الرياض,حي المهدية,الرياض
G206552822,ارض سكنية,0.0,0.0,3002.0,1900.0,للبيع ارض بحي البيان 3002م شارعين 30م ب1900ريال للمتر,حي البيان، شرق الرياض، الرياض,حي حي البيان,الرياض
G151960281,شقة,3.0,3.0,146.0,900000.0,شقة للبيع في الرمال، الرياض,الرمال، شرق الرياض، الرياض,حي الرمال,الرياض
T500719185,شقة,3.0,5.0,600.0,1100000.0,شقة للبيع في الجندرية، الرياض,الجنادرية، شرق الرياض، الرياض,حي الجنادرية,الرياض
W680818240,شقة,3.0,3.0,163.0,530000.0,شقة للبيع في عكاظ، جنوب الرياض,عكاظ، جنوب الرياض، الرياض,حي عكاظ,الرياض
B081401018,فیلا,8.0,5.0,450.0,5400000.0,"فيلا للبيع في النرجس, شمال الرياض",النرجس، شمال الرياض، الرياض,حي النرجس,الرياض
D821946759,ارض سكنية,0.0,0.0,375.0,780000.0,أرض للبيع في مخطط الخير، شمال الرياض,الرياض,حي الرياض,الرياض
E019389809,ارض سكنية,0.0,0.0,523.0,6000.0,أرض للبيع في العارض، شمال الرياض,العارض، شمال الرياض، الرياض,حي العارض,الرياض
Z104757533,فیلا,5.0,4.0,200.0,1300000.0,للبيع فيلا في حي الجنادرية مخطط المعالي,الجنادرية، شرق الرياض، الرياض,حي الجنادرية,الرياض
T374576068,فیلا,7.0,5.0,300.0,4000000.0,مشروع أبادي - 1 بحي ‫الياسمين,الياسمين، شمال الرياض، الرياض,حي الياسمين,الرياض
I514829571,شقة,3.0,3.0,3150.0,1365000.0,"شقة للبيع في العارض, شمال الرياض",العارض، شمال الرياض، الرياض,حي العارض,الرياض
N703783545,فیلا,5.0,3.0,289.0,1470000.0,🏡✨  للبيع فيلا الأحلام مع شقة مستقلة في مخطط بوابة الشرق  ✨🏡,الجنادرية، شرق الرياض، الرياض,حي الجنادرية,الرياض
M205981905,شقة,3.0,2.0,150.0,1300000.0,شقة للبيع في الملقا، شمال الرياض,الملقا، شمال الرياض، الرياض,حي الملقا,الرياض
Z990195871,ارض سكنية,0.0,0.0,319.0,3435.0,أرض سكنية للبيع في الرمال، شرق الرياض,الرمال، شرق الرياض، الرياض,حي الرمال,الرياض
E434840747,دور,3.0,1.0,187.0,1100000.0,🌟  الأدوار الفخمة - استمتع بتجربة السكن الفاخر في حي الرمال ريبال! 🏡✨,الرمال، شرق الرياض، الرياض,حي الرمال,الرياض
A121741709,دور,3.0,3.0,175.0,620000.0,دور 3 غرف نوم للبيع في بدر، الرياض,بدر، جنوب الرياض، الرياض,حي بدر,الرياض
J999964920,فیلا,3.0,2.0,440.0,1400000.0,✨🏡 فيلا درج داخلي رائعة للبيع 🏡✨,الجنادرية، شرق الرياض، الرياض,حي الجنادرية,الرياض
O493406065,استراحة,3.0,3.0,341.0,6000000.0,"Rest house for sale in Al Ramal, Riyadh",الرمال، شرق الرياض، الرياض,حي الرمال,الرياض
Y631740910,شقة,3.0,3.0,182.0,1900000.0,شقة للبيع في حي حطين ، شمال الرياض,حطين، شمال الرياض، الرياض,حي حطين,الرياض
J138392492,فیلا,5.0,4.0,360.0,3500000.0,فيلا للبيع في النرجس، شمال الرياض,النرجس، شمال الرياض، الرياض,حي النرجس,الرياض
F693399218,شقة,3.0,3.0,124.0,580000.0,شقة للبيع في السويدي، غرب الرياض,السويدي، غرب الرياض، الرياض,حي السويدي,الرياض
K483405986,شقة,4.0,3.0,132.0,680000.0,شقق جديدة للبيع في السعادة، شرق الرياض,السعادة، شرق الرياض، الرياض,حي السعادة,الرياض
Y539987170,فیلا,9.0,5.0,379.0,2000000.0,"فيلا للبيع في السعادة, شرق الرياض",السعادة، شرق الرياض، الرياض,حي السعادة,الرياض
M376580061,شقة,3.0,2.0,140.0,600000.0,"شقة للبيع في الرمال, شرق الرياض",الرمال، شرق الرياض، الرياض,حي الرمال,الرياض
K600054376,شقة,4.0,5.0,216.0,1373000.0,"شقة للبيع في العارض, شمال الرياض",العارض، شمال الرياض، الرياض,حي العارض,الرياض
L351269020,دور,3.0,3.0,193.0,540000.0,دور للبيع في  بدر، جنوب الرياض,بدر، جنوب الرياض، الرياض,حي بدر,الرياض
N062087818,دور,3.0,4.0,140.0,949000.0,شقة للبيع في الرمال، شرق الرياض,الرمال، شرق الرياض، الرياض,حي الرمال,الرياض
D104698284,شقة,4.0,3.0,177.0,450000.0,شقة للبيع في بدر، جنوب الرياض,بدر، جنوب الرياض، الرياض,حي بدر,الرياض
S904625500,دور,3.0,3.0,500.0,950000.0,ادوار للبيع في  شبرا، غرب الرياض,شبرا، غرب الرياض، الرياض,حي شبرا,الرياض
X564268706,شقة,5.0,3.0,128.0,550000.0,شقه للبيع في  الزهرة، غرب الرياض,الزهرة، غرب الرياض، الرياض,حي الزهرة,الرياض
N958226528,دور,4.0,3.0,500.0,860000.0,"دور للبيع في شبرا, غرب الرياض",شبرا، غرب الرياض، الرياض,حي شبرا,الرياض
U934146095,دور,4.0,4.0,500.0,860000.0,دور أرضي للبيع في شبرا، غرب الرياض,شبرا، غرب الرياض، الرياض,حي شبرا,الرياض
O424839322,دور,4.0,4.0,214.0,1430000.0,دور للبيع في العارض، شمال الرياض,العارض، شمال الرياض، الرياض,حي العارض,الرياض
E940246066,دور,4.0,3.0,500.0,860000.0,دور للبيع في شبرا، غرب الرياض,شبرا، غرب الرياض، الرياض,حي شبرا,الرياض
E739553712,شقة,5.0,4.0,171.0,650000.0,"شقه للبيع حي الغروب , الرياض",طويق، غرب الرياض، الرياض,حي طويق,الرياض
T077412920,عمارة سكنية,0.0,0.0,750.0,1299000.0,"شقة للبيع في الملك فيصل, شرق الرياض",الملك فيصل، شرق الرياض، الرياض,حي الملك فيصل,الرياض
Z255908560,شقة,3.0,2.0,175.0,663400.0,🏢✨  فرصة فريدة لامتلاك شقة في طويق - غرب الرياض!,طويق، غرب الرياض، الرياض,حي طويق,الرياض
G383274413,ارض سكنية,0.0,0.0,480.0,5900000.0,أرض سكنية للبيع في الملقا، شمال الرياض,الملقا، شمال الرياض، الرياض,حي الملقا,الرياض
M023797587,ارض سكنية,0.0,0.0,800.0,2050000.0,أرض سكنية للبيع في حي الخير، شمال الرياض,مخطط الخير، شمال الرياض، الرياض,حي مخطط الخير,الرياض
Q980046426,ارض سكنية,0.0,0.0,480.0,5850000.0,أرض للبيع في الملقا، شمال الرياض,الملقا، شمال الرياض، الرياض,حي الملقا,الرياض
R135067827,شقة,4.0,3.0,147.0,1300000.0,شقة للبيع في الملقا، شمال الرياض,الملقا، شمال الرياض، الرياض,حي الملقا,الرياض
Q542824172,فیلا,5.0,5.0,364.0,4400000.0,مشروع إعمار الياسمين بحي الياسمين,الياسمين، شمال الرياض، الرياض,حي الياسمين,الرياض
U076772864,فیلا,5.0,5.0,360.0,4100000.0,مشروع إعمار الياسمين بحي الياسمين,الياسمين، شمال الرياض، الرياض,حي الياسمين,الرياض
Q239655379,فیلا,3.0,5.0,250.0,3400000.0,مشروع أبادي - 1 بحي ‫الياسمين,الياسمين، شمال الرياض، الرياض,حي الياسمين,الرياض
N349421005,فیلا,3.0,5.0,250.0,3300000.0,"فيلا للبيع في الياسمين, شمال الرياض",الياسمين، شمال الرياض، الرياض,حي الياسمين,الرياض
K259497666,شقة,3.0,3.0,136.0,680000.0,شقة للبيع في حي السعادة، شرق الرياض,السعادة، شرق الرياض، الرياض,حي السعادة,الرياض
K341463441,عمارة,0.0,0.0,312.0,3700000.0,عمارة للبيع في الضباض، وسط الرياض,الضباط، وسط الرياض، الرياض,حي الضباط,الرياض
Q849167239,فیلا,9.0,6.0,490.0,15000000.0,حطين طريق الأمير محمد بن سلمان,حطين، شمال الرياض، الرياض,حي حطين,الرياض
D554727661,دور,4.0,4.0,214.0,760000.0,دور للبيع في بدر، جنوب الرياض,بدر، جنوب الرياض، الرياض,حي بدر,الرياض
Z952751472,دور,3.0,3.0,500.0,800000.0,أدوار للبيع في شبرا، غرب الرياض,شبرا، غرب الرياض، الرياض,حي شبرا,الرياض
C013290657,دور,3.0,3.0,214.0,760000.0,دور للبيع في بدر، جنوب الرياض,بدر، جنوب الرياض، الرياض,حي بدر,الرياض
K018925967,دور,4.0,4.0,214.0,760000.0,أدوار للبيع في بدر، جنوب الرياض,بدر، جنوب الرياض، الرياض,حي بدر,الرياض
C744104276,شقة,3.0,3.0,131.0,420000.0,شقة للبيع في الدار البيضاء، جنوب الرياض,الدار البيضاء، جنوب الرياض، الرياض,حي الدار البيضاء,الرياض
U958414783,شقة,4.0,3.0,190.0,1250000.0,"شقة فاخرة للبيع في النرجس, شمال الرياض (تم الحجز) (لدينا شقق أخرى) بنفس السعر والمواصفات",النرجس، شمال الرياض، الرياض,حي النرجس,الرياض
G806519368,شقة,3.0,4.0,1155.0,1200000.0,شقة فاخرة  للبيع بالعارض بسعر منافس وموقع متميز 3 غرف نوم منهم غرفتين نوم ماستر بحمام,العارض، شمال الرياض، الرياض,حي العارض,الرياض
X627474393,دور,3.0,3.0,500.0,860000.0,أدورا للبيع في شبرا، غرب الرياض,شبرا، غرب الرياض، الرياض,حي شبرا,الرياض
A906369951,شقة,3.0,3.0,3150.0,1240000.0,"شقة للبيع في العارض, شمال الرياض",العارض، شمال الرياض، الرياض,حي العارض,الرياض
E562543978,شقة,3.0,3.0,3150.0,1235000.0,"شقة للبيع في العارض, شمال الرياض",العارض، شمال الرياض، الرياض,حي العارض,الرياض
W524274354,شقة,4.0,4.0,163.0,2100000.0,شقة للبيع في حطين، شمال الرياض,حطين، شمال الرياض، الرياض,حي حطين,الرياض
T947839059,دور,4.0,3.0,625.0,700000.0,"دور للبيع في شارع الطفيل بن زيد, حي الزهرة, مدينة الرياض, منطقة الرياض",الزهرة، غرب الرياض، الرياض,حي الزهرة,الرياض
U845525076,شقة,3.0,3.0,153.0,650000.0,شقة 3 غرف نوم للبيع في السويدي، الرياض,السويدي، غرب الرياض، الرياض,حي السويدي,الرياض
P978826675,دور,3.0,4.0,362.0,1800000.0,دور للبيع في العارض، شمال الرياض,العارض، شمال الرياض، الرياض,حي العارض,الرياض
Y761170177,فیلا,4.0,5.0,400.0,5600000.0,"فيلا للبيع في الياسمين, شمال الرياض",الياسمين، شمال الرياض، الرياض,حي الياسمين,الرياض
A763958248,دور,3.0,5.0,211.0,1800000.0,"دور للبيع في الريان, شرق الرياض",الريان، شرق الرياض، الرياض,حي الريان,الرياض
T608796423,فیلا,5.0,6.0,990.0,11000000.0,فيلا راقية للبيع في الصحافة، شمال الرياض,الصحافة، شمال الرياض، الرياض,حي الصحافة,الرياض
G861017665,شقة,3.0,3.0,146.0,1019000.0,شقة للبيع في  الملك فيصل، شرق الرياض,الملك فيصل، شرق الرياض، الرياض,حي الملك فيصل,الرياض
Q645049391,شقة,2.0,2.0,144.0,1160000.0,"شقة للبيع في النرجس, شمال الرياض",النرجس، شمال الرياض، الرياض,حي النرجس,الرياض
I885190007,عمارة سكنية,0.0,0.0,336.0,5300000.0,عمارة للبيع في الورود، شمال الرياض,الورود، شمال الرياض، الرياض,حي الورود,الرياض
I797471380,دور,3.0,3.0,143.0,610000.0,دور للبيع في عكاظ، جنوب الرياض,عكاظ، جنوب الرياض، الرياض,حي عكاظ,الرياض
W778427702,دور,3.0,4.0,540.0,1450000.0,دور للبيع في المونسية، شرق الرياض,المونسية، شرق الرياض، الرياض,حي المونسية,الرياض
E979715550,شقة,4.0,4.0,143.0,1300000.0,شقة للبيع في الملقا، شمال الرياض,الملقا، شمال الرياض، الرياض,حي الملقا,الرياض
Q672444822,فیلا,4.0,5.0,400.0,2150000.0,فيلا فاخرة للبيع في المهدية، غرب الرياض,المهدية، غرب الرياض، الرياض,حي المهدية,الرياض
G258592692,شقة,3.0,3.0,161.0,975000.0,شقة للبيع في حي المهدية، غرب بالرياض,المهدية، غرب الرياض، الرياض,حي المهدية,الرياض
F588884204,شقة,4.0,3.0,125.0,650000.0,شقة للبيع في ظهرة لبن، غرب الرياض,ظهرة لبن، غرب الرياض، الرياض,حي ظهرة لبن,الرياض
O178654932,شقة,4.0,3.0,900.0,550000.0,شقة للبيع في بدر، جنوب الرياض,بدر، جنوب الرياض، الرياض,حي بدر,الرياض
M225406323,شقة,4.0,3.0,137.0,1350000.0,شقة للبيع في الوادي، شمال الرياض,الوادي، شمال الرياض، الرياض,حي الوادي,الرياض
V760234914,شقة,4.0,4.0,478.0,900000.0,"شقق مودرن للبيع في المهدية, غرب الرياض",المهدية، غرب الرياض، الرياض,حي المهدية,الرياض
C195758869,شقة,3.0,3.0,138.0,550000.0,شقة للبيع في السويدي، غرب الرياض,السويدي، غرب الرياض، الرياض,حي السويدي,الرياض
F454234640,شقة,3.0,3.0,152.0,530000.0,"شقق للبيع في الحزم, غرب الرياض",الحزم، غرب الرياض، الرياض,حي الحزم,الرياض
